{
  "schema_version": 1,
  "site_title": "AI 日报",
  "site_url": "https://jasonxzwen.github.io/ai-daily-cn/",
  "updated_at": "2026-06-17T05:02:52.033Z",
  "reports": [
    {
      "report_date": "2026-06-17",
      "title": "AI 日报 2026-06-17",
      "summary": "今天最值得看的主线有 Qwen 团队介绍机器人学习与多模态推理实验；OpenAI披露模型能力和评估方法更新；微软研究院更新AI 产品、平台或工程实践；热门博客这轮主要看 agent 和开发工具的落地边界。",
      "url": "reports/2026/06/2026-06-17.html",
      "data_url": "data/2026/06/2026-06-17.json",
      "main_items": 10,
      "builder_observations": 0,
      "generated_at": "2026-06-17T05:02:48.721Z"
    },
    {
      "report_date": "2026-06-16",
      "title": "AI 日报 2026-06-16",
      "summary": "今天的主线集中在三件事：阿里云把面向 Agentic Ops 的 RCA Benchmark 开源，AWS 将 Gemma 4 接入 Bedrock，Meta 继续把 AI 助手和创作工具嵌入 Facebook。工程侧还值得看 OpenClaw 的自托管协作入口、GitHub Copilot 指标口径变化，以及几篇关于 agent 评测、研究代理和训练效率的技术博客。整体信号偏平台与工程落地，质量状态仍受部分外部信源阻塞影响。",
      "url": "reports/2026/06/2026-06-16.html",
      "data_url": "data/2026/06/2026-06-16.json",
      "main_items": 10,
      "builder_observations": 0,
      "generated_at": "2026-06-16T05:24:27.434Z"
    },
    {
      "report_date": "2026-06-15",
      "title": "AI 日报 2026-06-15",
      "summary": "今天最值得看的主线有 阿里云汇总 2026 年 5 月安全产品新功能；阿里云示例用 HermesAgent 在 ECS 上自动汇总 Outlook 邮件；英伟达用压缩库和约 30 行代码降低训练检查点成本。",
      "url": "reports/2026/06/2026-06-15.html",
      "data_url": "data/2026/06/2026-06-15.json",
      "main_items": 5,
      "builder_observations": 3,
      "generated_at": "2026-06-16T04:12:45.930Z"
    },
    {
      "report_date": "2026-06-14",
      "title": "AI 日报 2026-06-14",
      "summary": "今天主线集中在平台生态、无障碍硬件、云数据库高可用和智能体工程：OpenAI 发布合作伙伴网络，Meta 推出面向失明退伍军人的免费 AI 眼镜计划，阿里云介绍 PolarDB-X Proxy 支撑百万级 QPS 与秒级故障恢复；同时收录 Anthropic 公共记录、Claude 合作与访问限制、Google Research 低碳计算和医疗理解研究，以及 agent 与开发工具博客动向。",
      "url": "reports/2026/06/2026-06-14.html",
      "data_url": "data/2026/06/2026-06-14.json",
      "main_items": 10,
      "builder_observations": 9,
      "generated_at": "2026-06-15T03:10:05.905Z"
    },
    {
      "report_date": "2026-06-12",
      "title": "AI 日报 2026-06-12",
      "summary": "今天主线集中在企业级 AI 落地、教育场景、云平台更新和 Agent 工程实践：Anthropic 与 DXC 推进 Claude 进入银行、航空和公共服务系统；OpenAI 展示 Preply 的 AI 加真人教师学习流程；阿里云发布 5 月大数据与 AI 平台月报，并补充 Agent 长期记忆和 Harness 实践。热门博客侧重 AI 诈骗防护、Agent 评测、用量报告、Slack 数据分析、安全扫描误报和 AI 工厂基础设施，开源侧继续保留 GitHub Trending Top 10 作为对照。",
      "url": "reports/2026/06/2026-06-12.html",
      "data_url": "data/2026/06/2026-06-12.json",
      "main_items": 10,
      "builder_observations": 6,
      "generated_at": "2026-06-12T10:28:57.162Z"
    },
    {
      "report_date": "2026-06-11",
      "title": "AI 日报 2026-06-11",
      "summary": "今天的主线集中在云平台接入、影响行动报告和 AI 基础设施三类更新：OpenAI 把模型与 Codex 接入 Oracle 云承诺，OpenAI 同时发布面向美国 AI 讨论的影响行动分析，Meta 继续解释算力在 AI 基础设施中的角色。开发工具侧，Codex、Copilot、Gemini、Gemma 与本地推理相关更新密集出现，说明模型能力正在进入云采购、浏览器、终端工具和安全审查流程。",
      "url": "reports/2026/06/2026-06-11.html",
      "data_url": "data/2026/06/2026-06-11.json",
      "main_items": 10,
      "builder_observations": 12,
      "generated_at": "2026-06-11T02:25:41.940Z"
    },
    {
      "report_date": "2026-06-10",
      "title": "AI 日报 2026-06-10",
      "summary": "今天的主线集中在三条并行脉络：Anthropic 正式发布 Claude Fable 5 与 Mythos 5，并说明两者是同一底层模型在不同访问和安全限制下的版本；OpenAI 连续发布 Nextdoor、LSEG、Notion 等企业案例，把 Codex 和可信 AI 放进真实工程与业务流程；NVIDIA、Meta、Microsoft、AWS、GitHub 等平台继续围绕推理部署、企业 agent、数据中心和开发者入口扩展 AI 基础设施。精选博客部分覆盖保险理赔 agent、Cloudflare 前沿模型防御、阿里云电商分析、Gemini 语音翻译、机器人强化学习和 Copilot 自定义 agent 工作流。",
      "url": "reports/2026/06/2026-06-10.html",
      "data_url": "data/2026/06/2026-06-10.json",
      "main_items": 10,
      "builder_observations": 12,
      "generated_at": "2026-06-10T09:54:48.781Z"
    },
    {
      "report_date": "2026-06-09",
      "title": "AI 日报 2026-06-09",
      "summary": "今天最值得看的主线有 英伟达介绍 Blackwell 低精度训练方案，用 JAX 工具链提速；苹果发布新一代系统级 AI 和 Siri；OpenAI 推出经济研究交流项目，面向 AI 经济影响研究；热门博客这轮主要看 agent 和开发工具的落地边界；GitHub Trending 继续保留完整 Top 10，方便对照开源侧动向。",
      "url": "reports/2026/06/2026-06-09.html",
      "data_url": "data/2026/06/2026-06-09.json",
      "main_items": 10,
      "builder_observations": 6,
      "generated_at": "2026-06-09T08:53:27.693Z"
    },
    {
      "report_date": "2026-06-08",
      "title": "AI 日报 2026-06-08",
      "summary": "今日主线是 SK Telecom and NVIDIA Build AI Infrastructure to Power Korea’s AI Innovation；NVIDIA and SK hynix Announce Multiyear Technology Partnership to Advance Memory for AI Factories；阿里云介绍 Data Security Center，重点是云上数据识别、风险治理和安全运营能力；GitHub Trending 从 mvanhorn/last30days-skill 开始补充 10 个开源信号；X/Twitter 保留 Simon Willison Weblog、Madhu Guru 等原帖的中文直译与原文。",
      "url": "reports/2026/06/2026-06-08.html",
      "data_url": "data/2026/06/2026-06-08.json",
      "main_items": 6,
      "builder_observations": 5,
      "generated_at": "2026-06-08T03:43:18.931Z"
    },
    {
      "report_date": "2026-06-07",
      "title": "AI 日报 2026-06-07",
      "summary": "今天最值得看的主线是 Cloudflare 给 AI Gateway 加上实时预算阈值，重点看多模型调用怎么控成本；另外保留 10 个 GitHub Trending Top 10 项目，用来补开源侧信号；技不止术补了 3 条深读，用来承接产品拆解、平台策略和工作流观察。",
      "url": "reports/2026/06/2026-06-07.html",
      "data_url": "data/2026/06/2026-06-07.json",
      "main_items": 1,
      "builder_observations": 6,
      "generated_at": "2026-06-08T10:08:24.558Z"
    },
    {
      "report_date": "2026-06-06",
      "title": "AI 日报 2026-06-06",
      "summary": "今天最值得看的主线有 GitHub 在 Copilot 多个体验里弃用 GPT-5.2 与 GPT-5.2-Codex；VS Code 开始公测企业统一管理插件能力；Meta 推出 Creator Assistant 并扩展 Facebook AI Translations 语言覆盖，重点是创作者运营和跨语言内容分发能否被自动化；另外保留 10 个 GitHub Trending Top 10 项目，用来补开源侧信号；技不止术补了 3 条深读，用来承接产品拆解、平台策略和工作流观察。",
      "url": "reports/2026/06/2026-06-06.html",
      "data_url": "data/2026/06/2026-06-06.json",
      "main_items": 10,
      "builder_observations": 6,
      "generated_at": "2026-06-08T10:03:32.007Z"
    },
    {
      "report_date": "2026-06-05",
      "title": "AI 日报 2026-06-05",
      "summary": "今日重点集中在安全治理、agent 与开发工具、模型研究与评测、产品与平台动态；内容生成相关 1 条；GitHub Trending 展示当日 Top 10；Builder 观察只保留与 AI 工具、模型或 agent 实践直接相关的原帖。",
      "url": "reports/2026/06/2026-06-05.html",
      "data_url": "data/2026/06/2026-06-05.json",
      "main_items": 10,
      "builder_observations": 6,
      "generated_at": "2026-06-05T14:44:21.320Z"
    },
    {
      "report_date": "2026-06-04",
      "title": "AI 日报 2026-06-04",
      "summary": "今日主线：主体覆盖 10 条一手或可信信号，GitHub Trending Top 10，Builder/X 观察 6 条；社区线索保留中介来源和核验边界。",
      "url": "reports/2026/06/2026-06-04.html",
      "data_url": "data/2026/06/2026-06-04.json",
      "main_items": 10,
      "builder_observations": 6,
      "generated_at": "2026-06-04T10:58:43.815Z"
    },
    {
      "report_date": "2026-06-03",
      "title": "AI 日报 2026-06-03",
      "summary": "今天的主线从“能不能用模型”转向“怎么把 agent 放进真实工作流”：Anthropic 把 AI 网络威胁映射到 ATT&CK，OpenAI 和 GitHub 同时扩展 Codex/Copilot 的嵌入方式，Qwen 与 AWS/NVIDIA 把多模态、模型定制和端侧 agent 继续工程化；国内动态侧单独保留千问开放 Agent/Skill、火山/Seedance 商业化、具身智能融资和 WorldArena 排名等待核验线索。",
      "url": "reports/2026/06/2026-06-03.html",
      "data_url": "data/2026/06/2026-06-03.json",
      "main_items": 14,
      "builder_observations": 6,
      "generated_at": "2026-06-03T13:11:20.271Z"
    },
    {
      "report_date": "2026-06-02",
      "title": "AI 日报 2026-06-02",
      "summary": "今天这份更像一张 AI 行业地图：OpenAI 进入 AWS、Anthropic 推进上市、GitHub 改 Copilot 计费，属于平台和商业模式的大新闻；NVIDIA、AWS 把 agent 往边缘、本地和企业权限链路推；AIGC 侧则出现内容生产 workflow、视频 agent、短视频开源项目和 AI PC 线索，适合工程师判断工具、成本和产品方向。",
      "url": "reports/2026/06/2026-06-02.html",
      "data_url": "data/2026/06/2026-06-02.json",
      "main_items": 10,
      "builder_observations": 3,
      "generated_at": "2026-06-02T06:14:41.487Z"
    },
    {
      "report_date": "2026-06-01",
      "title": "AI 日报 2026-06-01",
      "summary": "今天主体信息扩展到 10 条：计费与成本归因、企业 agent 平台、国产模型、physical AI、企业 BI、AIGC 内容工具和科研应用一起进入日报视野。模型可用性 incident 被放入轻量运营线索，模型发布只保留 MiniMax M3 和 Cosmos 3 这类首发。",
      "url": "reports/2026/06/2026-06-01.html",
      "data_url": "data/2026/06/2026-06-01.json",
      "main_items": 10,
      "builder_observations": 3,
      "generated_at": "2026-06-01T16:00:00+08:00"
    },
    {
      "report_date": "2026-05-31",
      "title": "AI 日报 2026-05-31",
      "summary": "今天的主线是 AI 从能力发布继续转向可审计落地：OpenAI 把第三方评测报告拆成 claim、harness 和有效性证据，GitHub 则把 Copilot 采用度推进到代码优先、agent 优先和多 agent cohort。开源侧，语音生成、coding agent workflow 和 AI 生成前端代码质检继续占据 GitHub Trending 前排。",
      "url": "reports/2026/05/2026-05-31.html",
      "data_url": "data/2026/05/2026-05-31.json",
      "main_items": 2,
      "builder_observations": 3,
      "generated_at": "2026-05-30T18:48:38.339Z"
    },
    {
      "report_date": "2026-05-30",
      "title": "AI 日报 2026-05-30",
      "summary": "今天的主线是前沿模型进入更窄、更可审计的使用场景：OpenAI 把 GPT-Rosalind 放进公共卫生和生物防御伙伴的可信访问链路，Google Cloud 将 Nano Banana 2 与 Nano Banana Pro 推到企业平台 GA，Anthropic 用 Series H 把安全研究、产品和算力供应链绑在一起。GitHub Trending 继续由视频生成、文档摄取、coding agent 和开源 CRM 占据前排。",
      "url": "reports/2026/05/2026-05-30.html",
      "data_url": "data/2026/05/2026-05-30.json",
      "main_items": 3,
      "builder_observations": 3,
      "generated_at": "2026-05-29T18:39:17.274Z"
    },
    {
      "report_date": "2026-05-29",
      "title": "AI 日报 2026-05-29",
      "summary": "今天的主线是模型能力、企业可运维性和 agent 采用证据同时推进：Claude Opus 4.8 发布后当天进入 AWS，Mistral 把检索、Vibe 和工业工程打成企业方案，AWS 开始把 OpenAI / Anthropic 兼容端点的 token 配额放进 Service Quotas，Anthropic 的社科调研把 coding agent 从演示拉回真实采用率与不平等问题。",
      "url": "reports/2026/05/2026-05-29.html",
      "data_url": "data/2026/05/2026-05-29.json",
      "main_items": 4,
      "builder_observations": 3,
      "generated_at": "2026-05-28T18:48:09.023Z"
    },
    {
      "report_date": "2026-05-28",
      "title": "AI 日报 2026-05-28",
      "summary": "今日重点收敛到三件事：Codex context compaction latency 已恢复，但长上下文任务仍需要把供应商状态页纳入 runbook；OpenAI/Cisco 与 GitHub Changelog 都在把 coding agent 的企业落地推到权限、记忆、模型准入和质量门禁层；GitHub Trending Top 10 与 Builder 观察显示 agent 工作流正在转向 repo 规则、skills 和团队流程。",
      "url": "reports/2026/05/2026-05-28.html",